{
  "package_id": "ETP-PCR02-OTA-001",
  "run_id": "FEATURE-PCR02-OTA-001",
  "repo_root": "jiying2007/ota_download_test",
  "base_commit": "eeb926bd1fff75d2a5d5abb9f0ede9c8f582cc6d",
  "dirty_baseline": null,
  "goal": "Make the existing PCR02 v1.1.21 OTA package identity machine-readable and fail-closed without changing package bytes.",
  "non_goals": ["Do not install the OTA on a device.", "Do not claim device boot, rollback, or release readiness."],
  "implementation_plan": ["Add a strict machine-readable OTA manifest for PCR02 v1.1.21.", "Add a stdlib fail-closed verifier for path containment, size, SHA-256 and checksum-list consistency.", "Add negative tests for malformed and conflicting identity inputs.", "Run Hosted CI against the actual OTA package and retain the verification receipt."],
  "acceptance_criteria": ["Machine-readable manifest binds PCR02 v1.1.21 package path, size, SHA-256 and source identity.", "Verifier rejects malformed identity, path traversal, size mismatch, SHA mismatch and duplicate checksum entries.", "Hosted CI verifies the real 76,778,472-byte package and retains a machine receipt."],
  "allowed_actions": ["A0_READ", "A1_ANALYZE", "A2_GENERATE", "A3_MODIFY_WORKTREE", "A4_BUILD_TEST"],
  "forbidden_actions": ["A6_DEVICE_WRITE", "A7_RELEASE"],
  "required_verification": ["host"],
  "evidence_refs": ["jiying2007/ota_download_test@eeb926bd1fff75d2a5d5abb9f0ede9c8f582cc6d", "ota_pkg_v1.1.21.tar.gz sha256:7687d8058f85271e75ff3726957385afa1618aa2078dc0a6b3215d470af4a4bb"],
  "knowledge_refs": [],
  "risks": ["Hosted verification covers artifact identity only, not device OTA behavior."],
  "unverified_items": ["Device download/install/boot/rollback are outside this Feature Pilot."],
  "downstream_contract": ["Use the retained identity receipt as an input to the separate Review/Release Pilot."]
}
